{
  "schema_version": "0.1",
  "manifest_type": "model-license",
  "model_id": "toto-2-4m",
  "code_license": "Apache-2.0",
  "weights_license": "Apache-2.0",
  "allowed_use": "commercial-evaluation",
  "source_url": "https://huggingface.co/Datadog/Toto-2.0-4m",
  "package_name": "toto-2",
  "package_version": "2.0.0",
  "package_sha256": "5eb922f8162a800d6d31cffb10e3f4c079276b12c41e272129e5b4a930943f71",
  "checkpoint": "Datadog/Toto-2.0-4m",
  "checkpoint_revision": "8306a9801cf98c0f5ffe4b2dcc8f496e616d84d9",
  "verified_at": "2026-09-04",
  "notes": "コードと重みはいずれもApache-2.0。商用評価専用で、製品採用には別途実設備検証・安全審査・運用承認が必要。"
}
